鄉鎮別,機構別,季底實際安置服務人數,全日型住宿人數-男,全日型住宿人數-女,夜間型住宿人數-男,夜間型住宿人數-女,日間照顧人數-男,日間照顧人數-女,部分時制照顧人數-男,部分時制照顧人數-女,本期服務人次,季底實際服務早期療育人數-領有身心障礙手冊/證明,季底實際服務早期療育人數-領有發展遲緩證明,季底特教單位委託人數,季底勞政單位委託人數
嘉義縣東石鄉,財團法人天主教會嘉義教區附設嘉義縣私立聖心教養院,70,21,26,0,0,18,5,0,0,0,0,0,0,0
嘉義縣鹿草鄉,財團法人嘉義縣私立一心教養院,59,32,27,0,0,0,0,0,0,0,0,0,0,0
嘉義縣鹿草鄉,嘉義縣私立嘉義教養院,22,16,6,0,0,0,0,0,0,0,0,0,0,0
嘉義縣民雄鄉,嘉義縣私立仲埔教養院,28,17,11,0,0,0,0,0,0,0,0,0,0,0
嘉義縣水上鄉,財團法人嘉義縣私立嘉惠教養院,23,12,11,0,0,0,0,0,0,0,0,0,0,0
嘉義縣大林鎮,嘉義縣私立大林教養院,21,10,11,0,0,0,0,0,0,0,0,0,0,0
嘉義縣民雄鄉,財團法人若竹兒教育基金會附設嘉義縣私立若竹兒智能發展中心,30,0,0,0,0,15,15,0,0,0,0,0,0,0
嘉義縣朴子市,財團法人天主教會嘉義教區附設嘉義縣私立敏道家園,123,63,60,0,0,0,0,0,0,0,0,0,0,0
